{
  "schemaVersion": 10,
  "targetDecision": {
    "requestedTarget": "directx",
    "selectedTarget": "directx",
    "selectionReason": "explicit-target",
    "selectedTargetNativeImplemented": false,
    "selectedTargetSourcePackageSupported": true,
    "selectedTargetPackageBuildSupported": true,
    "selectedTargetPackageMode": "source-package",
    "selectedTargetMissingCapabilityCount": 0,
    "selectedTargetMissingCapabilities": [],
    "selectedTargetMissingCapabilityGroups": [],
    "selectedTargetDiagnosticCount": 0,
    "diagnostics": [],
    "viableTargets": [
      "directx"
    ],
    "fallbackTargets": [],
    "fallbackTargetRecordCount": 0,
    "fallbackTargetRecords": [],
    "nonViableTargets": []
  },
  "targetCapabilities": {
    "defaultTarget": "directx",
    "summaries": [
      {
        "target": "directx",
        "nativeImplemented": false,
        "sourcePackageSupported": true,
        "packageBuildSupported": true,
        "packageMode": "source-package",
        "packageDecisionReason": "source-package-available",
        "packageRankScore": 0,
        "requiredCapabilityCount": 0,
        "missingCapabilityCount": 0,
        "requiredCapabilities": [],
        "missingCapabilities": [],
        "requiredCapabilityGroups": [],
        "missingCapabilityGroups": []
      }
    ]
  },
  "hirSourceLocations": {
    "expressionCount": 0,
    "expressionWithLocationCount": 0,
    "typeCount": 0,
    "typeWithLocationCount": 0,
    "expressions": [],
    "types": []
  },
  "manualTextureCompareKernelSummary": {
    "totalCount": 4,
    "staticNormalizedCount": 4,
    "staticNonNormalizedCount": 0,
    "staticZeroSumCount": 0,
    "dynamicCount": 0
  },
  "manualTextureCompareKernelBuckets": {
    "staticNormalized": [
      0,
      1,
      2,
      3
    ],
    "staticNonNormalized": [],
    "staticZeroSum": [],
    "dynamic": []
  },
  "manualTextureCompareKernels": [
    {
      "index": 0,
      "stage": "compute",
      "entryPoint": "compute_main",
      "function": "main",
      "operation": "textureCompareLodManualKernel",
      "sourceKind": "tap-list",
      "canonicalOperation": "textureCompareLodManualKernel",
      "compatibilityAlias": false,
      "weightClass": "static-normalized",
      "tapCount": 1,
      "weightsStatic": true,
      "weightsZeroSum": false,
      "weightsNormalized": true,
      "weightSum": 1.0
    },
    {
      "index": 1,
      "stage": "compute",
      "entryPoint": "compute_main",
      "function": "main",
      "operation": "textureCompareLodManualKernel",
      "sourceKind": "tap-list",
      "canonicalOperation": "textureCompareLodManualKernel",
      "compatibilityAlias": false,
      "weightClass": "static-normalized",
      "tapCount": 1,
      "weightsStatic": true,
      "weightsZeroSum": false,
      "weightsNormalized": true,
      "weightSum": 1.0
    },
    {
      "index": 2,
      "stage": "compute",
      "entryPoint": "compute_main",
      "function": "main",
      "operation": "textureCompareLodManualKernel",
      "sourceKind": "tap-list",
      "canonicalOperation": "textureCompareLodManualKernel",
      "compatibilityAlias": false,
      "weightClass": "static-normalized",
      "tapCount": 1,
      "weightsStatic": true,
      "weightsZeroSum": false,
      "weightsNormalized": true,
      "weightSum": 1.0
    },
    {
      "index": 3,
      "stage": "compute",
      "entryPoint": "compute_main",
      "function": "main",
      "operation": "textureCompareLodManualKernel",
      "sourceKind": "tap-list",
      "canonicalOperation": "textureCompareLodManualKernel",
      "compatibilityAlias": false,
      "weightClass": "dynamic",
      "tapCount": 1,
      "weightsStatic": true,
      "weightsZeroSum": false,
      "weightsNormalized": true,
      "weightSum": 1.0
    }
  ]
}
