{
  "schemaVersion": 10,
  "targetDecision": {
    "requestedTarget": "directx",
    "selectedTarget": "directx",
    "selectionReason": "explicit-target",
    "selectedTargetNativeImplemented": false,
    "selectedTargetSourcePackageSupported": true,
    "selectedTargetPackageBuildSupported": true,
    "selectedTargetPackageMode": "source-package",
    "selectedTargetMissingCapabilityCount": 0,
    "selectedTargetMissingCapabilities": [],
    "selectedTargetMissingCapabilityGroups": [],
    "selectedTargetDiagnosticCount": 0,
    "diagnostics": [],
    "viableTargets": [
      "directx"
    ],
    "fallbackTargets": [],
    "fallbackTargetRecordCount": 0,
    "fallbackTargetRecords": [],
    "nonViableTargets": []
  },
  "targetCapabilities": {
    "defaultTarget": "directx",
    "summaries": [
      {
        "target": "directx",
        "nativeImplemented": false,
        "sourcePackageSupported": true,
        "packageBuildSupported": true,
        "packageMode": "source-package",
        "packageDecisionReason": "source-package-available",
        "packageRankScore": 0,
        "requiredCapabilityCount": 0,
        "missingCapabilityCount": 0,
        "requiredCapabilities": [],
        "missingCapabilities": [],
        "requiredCapabilityGroups": [],
        "missingCapabilityGroups": []
      },
      {
        "target": "vulkan",
        "nativeImplemented": true,
        "sourcePackageSupported": true,
        "packageBuildSupported": true,
        "packageMode": "native",
        "packageDecisionReason": "native-package-available",
        "packageRankScore": 1,
        "requiredCapabilityCount": 0,
        "missingCapabilityCount": 0,
        "requiredCapabilities": [],
        "missingCapabilities": [],
        "requiredCapabilityGroups": [],
        "missingCapabilityGroups": []
      },
      {
        "target": "metal",
        "nativeImplemented": true,
        "sourcePackageSupported": true,
        "packageBuildSupported": true,
        "packageMode": "native",
        "packageDecisionReason": "native-package-available",
        "packageRankScore": 2,
        "requiredCapabilityCount": 0,
        "missingCapabilityCount": 3,
        "requiredCapabilities": [],
        "missingCapabilities": [
          "native-backend",
          "package-build",
          "runtime-specialization"
        ],
        "requiredCapabilityGroups": [],
        "missingCapabilityGroups": [
          {
            "kind": "backend",
            "count": 1,
            "capabilities": [
              "native-backend"
            ]
          },
          {
            "kind": "package",
            "count": 1,
            "capabilities": [
              "package-build"
            ]
          },
          {
            "kind": "runtime",
            "count": 0,
            "capabilities": [
              "runtime-specialization"
            ]
          }
        ]
      }
    ]
  },
  "hirSourceLocations": {
    "expressionCount": 0,
    "expressionWithLocationCount": 0,
    "typeCount": 0,
    "typeWithLocationCount": 0,
    "expressions": [],
    "types": []
  },
  "manualTextureCompareKernelSummary": {
    "totalCount": 0,
    "staticNormalizedCount": 0,
    "staticNonNormalizedCount": 0,
    "staticZeroSumCount": 0,
    "dynamicCount": 0
  },
  "manualTextureCompareKernelBuckets": {
    "staticNormalized": [],
    "staticNonNormalized": [],
    "staticZeroSum": [],
    "dynamic": []
  },
  "manualTextureCompareKernels": []
}
